[
  {
    "id": "seed-001",
    "request": "Run npm test",
    "state": "IDLE",
    "availableTools": ["run_command", "read_file", "edit_file"],
    "intent": "run_command",
    "actionClass": "local_tool",
    "toolFamily": "terminal",
    "needsLLM": false,
    "needsVerification": true,
    "isHardNegative": false,
    "source": "seed"
  },
  {
    "id": "seed-002",
    "request": "Open src/auth/login.js",
    "state": "IDLE",
    "availableTools": ["read_file", "list_files", "edit_file"],
    "intent": "inspect",
    "actionClass": "local_tool",
    "toolFamily": "filesystem",
    "needsLLM": false,
    "needsVerification": false,
    "isHardNegative": false,
    "source": "seed"
  },
  {
    "id": "seed-003",
    "request": "Find why authentication is failing",
    "state": "EXECUTING",
    "availableTools": ["search_workspace", "read_file", "run_command"],
    "intent": "debug",
    "actionClass": "main_llm",
    "toolFamily": "filesystem",
    "needsLLM": true,
    "needsVerification": true,
    "isHardNegative": false,
    "source": "seed"
  },
  {
    "id": "seed-004",
    "request": "Explain this function in detail",
    "state": "IDLE",
    "availableTools": ["read_file"],
    "intent": "explain",
    "actionClass": "main_llm",
    "toolFamily": "none",
    "needsLLM": true,
    "needsVerification": false,
    "isHardNegative": false,
    "source": "seed"
  },
  {
    "id": "seed-005",
    "request": "Run git status",
    "state": "IDLE",
    "availableTools": ["git_status", "git_diff", "run_command"],
    "intent": "git",
    "actionClass": "local_tool",
    "toolFamily": "git",
    "needsLLM": false,
    "needsVerification": false,
    "isHardNegative": false,
    "source": "seed"
  },
  {
    "id": "seed-006",
    "request": "Create a React login component in src/components/Login.jsx",
    "state": "PLANNING",
    "availableTools": ["create_file", "write_file", "read_file"],
    "intent": "create",
    "actionClass": "main_llm",
    "toolFamily": "editor",
    "needsLLM": true,
    "needsVerification": true,
    "isHardNegative": false,
    "source": "seed"
  },
  {
    "id": "seed-007",
    "request": "Check whether the last change passes tests",
    "state": "EVALUATING",
    "availableTools": ["run_command", "verify"],
    "intent": "verify",
    "actionClass": "verification",
    "toolFamily": "testing",
    "needsLLM": false,
    "needsVerification": true,
    "isHardNegative": false,
    "source": "seed"
  },
  {
    "id": "seed-008",
    "request": "Undo the last agent change",
    "state": "EVALUATING",
    "availableTools": ["rollback", "git_diff"],
    "intent": "recover",
    "actionClass": "recovery",
    "toolFamily": "diagnostics",
    "needsLLM": false,
    "needsVerification": false,
    "isHardNegative": false,
    "source": "seed"
  },
  {
    "id": "seed-009",
    "request": "Tell me what npm test does.",
    "state": "IDLE",
    "availableTools": ["run_command", "read_file"],
    "intent": "explain",
    "actionClass": "main_llm",
    "toolFamily": "none",
    "needsLLM": true,
    "needsVerification": false,
    "isHardNegative": true,
    "source": "hard_negative"
  },
  {
    "id": "seed-010",
    "request": "Run npm test and explain why it fails.",
    "state": "IDLE",
    "availableTools": ["run_command", "read_file"],
    "intent": "debug",
    "actionClass": "main_llm",
    "toolFamily": "terminal",
    "needsLLM": true,
    "needsVerification": true,
    "isHardNegative": true,
    "source": "hard_negative"
  },
  {
    "id": "seed-011",
    "request": "Inspect auth.ts but don't modify anything.",
    "state": "IDLE",
    "availableTools": ["read_file", "edit_file"],
    "intent": "inspect",
    "actionClass": "local_tool",
    "toolFamily": "filesystem",
    "needsLLM": false,
    "needsVerification": false,
    "isHardNegative": true,
    "source": "hard_negative"
  },
  {
    "id": "seed-012",
    "request": "Search for where process.env.VITE_DEV_SERVER_URL is used",
    "state": "IDLE",
    "availableTools": ["search_workspace", "read_file"],
    "intent": "search",
    "actionClass": "local_tool",
    "toolFamily": "search",
    "needsLLM": false,
    "needsVerification": false,
    "isHardNegative": false,
    "source": "seed"
  },
  {
    "id": "seed-013",
    "request": "Refactor the database queries in DatabaseManager.js to use prepared statements",
    "state": "EXECUTING",
    "availableTools": ["read_file", "edit_file", "run_command"],
    "intent": "refactor",
    "actionClass": "main_llm",
    "toolFamily": "editor",
    "needsLLM": true,
    "needsVerification": true,
    "isHardNegative": false,
    "source": "seed"
  },
  {
    "id": "seed-014",
    "request": "git diff to see unstaged changes",
    "state": "IDLE",
    "availableTools": ["git_diff", "git_status"],
    "intent": "git",
    "actionClass": "local_tool",
    "toolFamily": "git",
    "needsLLM": false,
    "needsVerification": false,
    "isHardNegative": false,
    "source": "seed"
  },
  {
    "id": "seed-015",
    "request": "What is the git status command doing in the background?",
    "state": "IDLE",
    "availableTools": ["git_status"],
    "intent": "explain",
    "actionClass": "main_llm",
    "toolFamily": "none",
    "needsLLM": true,
    "needsVerification": false,
    "isHardNegative": true,
    "source": "hard_negative"
  }
]
